piece	strip	Were it not for the pension <x>piece</x> we would not be on strike.' and summed up the whole conflict as 'a fight over dignity and respect on the job, a concept that is very alien to the MTA. Transit workers are tired of being underappreciated and disrespected.	Palestinian President Mahmoud Abbas has urged the United Nations Security Council to call for Israel to immediately cease aggression in the Gaza <y>Strip</y>.	independent	1.0
black	grey	Earlier in the year, Belgium's first <x>black</x> city registrar organised a mass wedding against racism that caught international media attention.	In September 2007 Alex the <y>Grey</y> Parrot, who had learned to speak a variety of words and distinguish colors and shapes, died after a protracted illness.	independent	0.6
edge	mountain	This constant development program has occasionally been accused of being aimed at forcing users to constantly pay out for expensive new software, but the returns of regular releases have been quick bug fixes and leading <x>edge</x> technology.	Authorities in Swiss canton of Appenzell Innerrhoden have warned that starting from February 9, the government will impose hefty fines of 200 Swiss Francs (£122, €135) on naturists found walking or hiking in the nude without clothes in the picturesque <y>mountains</y> because of a recent influx of visiting German nudists.	independent	1.0
ride	surf	C2 classified He also set a classification world record in her <x>ride</x>, with a time of 42.448 seconds and factored time of 39.158 seconds.	Each month its demographic users aged between 16 and 24-years of age inclusive spend a combined total of 2.14 billion minutes a month <y>surfing</y> the highly popular site; or 40 minutes a day per user.	independent	0.8
adult	mother	All the deceased were <x>adults</x>, and included one of the two drivers, the other of whom was seriously injured.	She rejected that the Federal Government deserve congratulations over settlement: 'To have gone through these proceedings, and spent the amount of money they have spent, to put Shayan's <y>mother</y> in the witness box for two weeks, is not an indication of a willingness and public accountability by the Government to accept responsibility for their actions,' Senator Nettle said.	reverse_entailment	1.0
fire	weapon	The suspect, Jesse J. Warren, walked into the Penske Truck Rental business Tuesday afternoon wearing camouflage and opened <x>fire</x> on the business.	House Republican leader John Boehner compared the new bill to using a nuclear <y>weapon</y> on an ant.	other-related	0.8
animal	cat	American-based online retailer Amazon.com has backtracked from its July decision and actions to remotely delete George Orwell's classic dystopian novels, 'Nineteen Eighty-Four' and '<x>Animal</x> Farm', from customers' Kindle e-book readers.	The measurements put the fossil, the smallest discovered in North America, at one and a half feet (50 centimetres) tall, weighing in at an estimated 4 to 5 pounds (1.8-2.2 kilograms) when it was alive, about the size of today's modern domesticated <y>cat</y>.	reverse_entailment	1.0
baseball	hit	Although a Taiwanese wrestler recently won a world-class pro-wrestling title, due to policies that focused only on promoting key athletic sports like <x>baseball</x>, billiards, basketball, and taekwondo (i.e. those with more possibilities to win a gold medal in the Asian Games or Olympics), governmental officials lost a great opportunity to promote sports like wrestling, which has many potential participants.	Shares in all three companies shot up amid the news of a potential deal, although they have begun falling again, and did not <y>hit</y> last year's highs.	independent	1.0
clothing	vest	The foreigners have also enforced a strict Islamic code forbidding the wearing of Western <x>clothing</x>, and shops selling music and satellite dishes have been closed.	A bullet proof <y>vest</y> stopped the first bullet from penetrating her chest area.	reverse_entailment	1.0
piece	strip	He said 'The body of the plane is in a state of destruction, there is not one intact <x>piece</x> of wing or fuselage'.	Meanwhile, Hamas, a group friendly to Islamic Jihad, made a rare public appearance 2 days before the Israeli pull-out of settlers and troops from The Gaza <y>Strip</y>.	independent	1.0
ball	toy	One fine pass by Chalme into the box was aimed for a wide open Odemwingie, but he was not able to cleanly hit the <x>ball</x>, and the danger passed.	Great for the brain but not what you'd call a <y>toy</y>.	forward_entailment	0.4
track	path	A South African couple died after being hit by a freight train while having sexual intercourse on railroad <x>tracks</x>.	York A New Jersey woman, 31-year-old Rabita Sarker, gave birth on a moving Port Authority Trans-Hudson (<y>PATH</y>) train yesterday morning.	independent	1.0
sand	shore	Transaven, a small local company, regularly flies to Los Roques, a national park and a popular tourist destination boasting white <x>sand</x> beaches and world-class scuba-diving sites.	One of those deaths may have been when waves spawned by Cimaron swept away a 19 year old female student, identified as Clarissa Otrera, while swimming near the <y>shore</y>, drowning her.	other-related	0.6
girl	person	She had two <x>girls</x> and six boys, each weighing between 1lb 8oz (680g) and 3lb 4ozs (1.47 kg), at the Kaiser Permanante Medical Center in Bellflower, southern California.	A two-vehicle road traffic accident in in Ireland has left one <y>person</y> dead and injured two others.	forward_entailment	1.0
food	pan	Initially the aid from United Nations World <x>Food</x> Program will cover 150 tonnes of food to feed 13,000 people for a month in North Korea's worst hit northern Songchon county.	Statler's <y>Pan</y>-American Hotel was financially unsuccessful.	independent	1.0
hockey	play	Quigley was the sponsor of the proclamation and plans to play ice <x>hockey</x> in the games.	In the announcement, the Norwegian Nobel Committee emphasizes the role the IAEA <y>plays</y> in preventing military use of nuclear energy arms proliferation, and ensuring peaceful use of nuclear energy.	independent	1.0
bicycle	ramp	The new Belgian champion Simon Decuyper was only 13th out of the water but was the fastest to complete the 4 <x>bicycle</x> laps, with still energy left to catch up with and run away from Stijn Goris halfway the second of three laps.	In the YouTube video, he can be seen standing on the exit <y>ramp</y> of Interstate 71 at Hudson Street, holding a sign claiming that he has 'the god-given gift of a great voice' and that he had 'fallen on hard times', as well as speaking to Doral Chenoweth III from daily newspaper The Columbus Dispatch.	independent	0.6
bride	couple	More information on Mormonism: On Friday, August 4, <x>bride</x>-to-be Julianna Redd's parents, Lemeul and Julia Redd, told her that she was going on a shopping trip but instead she was driven 390 km (240 miles) from Provo, Utah to Grand Junction, Colorado by her parents trying to talk her out of getting married.	Their lawyer Paul Castillo said today the <y>couple</y> 'knew that by coming forward they could help accelerate equality for all same-sex couples in Indiana by demonstrating the urgency of their need for equal dignity.'	other-related	0.6
pose	stand	The Environmental Protection Agency (EPA) analyzed soot in the area and determined that it did not <x>pose</x> a substantial health risk.	As well as films and television, Williams did <y>stand</y>-up comedy and appeared on chat shows; he appeared on the finale of Johnny Carson's tenure hosting 'The Tonight Show'.	independent	1.0
field	yard	Those injured in the attack were moved to the <x>field</x> hospital at Kandahar Air<x>field</x> and are expected to survive.	The reaction of Scotland <y>Yard</y> was right: it's not because these people had committed an offence that they should be excluded forever, certainly not when they had served their sentences.	independent	1.0
crowd	gathering	This response force will not be called upon to help with law enforcement, civil disturbance or <x>crowd</x> control, but will be used to support lead agencies involved in saving lives, relieving suffering and meeting the needs of communities affected by weapons of mass destruction attacks, accidents or even natural disasters.	Becky explained to us that she was in Brussels to <y>gather</y> support for a European movement against this proposal.	independent	0.8
air	flight	Living ten blocks from where the explosion occurred, 58-year-old Jose Luis Chavez explained that he had heard a minimum of two loud explosions and witnessed flames rising over 10 meters (30Â feet) into the <x>air</x>.	According to airline spokeswoman Jenny Dervin, JetBlue will not be releasing more details on Slater's employment status in respect of the former <y>flight</y> attendant's privacy.	other-related	1.0
dress	wedding	Banksy installed a sculpture, a life-size doll <x>dressed</x> in an prison inmate's orange jumpsuit and bound and shackled, behind the bars of the Big Thunder Mountain Railroad ride.	The proposed <y>wedding</y> is likely to raise many religious and constitutional questions, especially as Mrs Parker Bowles is divorced and her husband is still alive.	independent	1.0
note	paper	They <x>noted</x> that while the defence had presented a 'no harm-no foul argument', in which it was argued that the accused were owed the money appropriated, 'such arguments usually fare badly in criminal cases'.	The <y>paper</y> referred to the meeting as 'three hours of emotional exchange' quoting Chavez as saying 'This is the best visit I've ever had in my life.'	independent	0.8
swimming	water	Fifteen people, including the boat driver and two staff members, were able to <x>swim</x> to safety after the boat capsized, but officials believe there are no other survivors.	The statement added that 'all evidence clearly indicated' that at the time of the seizure, the British naval personnel were on a routine patrolling mission in Iraqi <y>waters</y>, and called the Iranian seizure a 'clear breach' of international law.	other-related	1.0
talk	phone	Hu refused the meeting days before due to <x>talks</x> about Harper bringing up China's human rights record.	Mobile <y>phones</y> and driving safety	independent	0.6
clothing	vest	The unnamed elderly woman was receiving oxygen for medical problems in her home and lit a cigarette, and the oxygen coming from her mask facilitated the ignition of her <x>clothing</x>, setting her on fire.	After an entire night of playing cat and mouse games with police, Christopher Speight surrendered to police of his own volition early Wednesday morning unarmed but wearing a bulletproof <y>vest</y>.	reverse_entailment	1.0
head	official	On the sixth hand of <x>heads</x>-up play against American Steve Dannenman, Hachem made a seven-high straight on the flop, which held up until the river to give him the win.	There was heavy rain, strong winds, and visibility was poor, <y>officials</y> said.	independent	1.0
gun	pistol	Police state he made a video of himself shooting a <x>gun</x> and later posted it on 'YouTube'.	During a search of a building, troops found three <y>pistols</y>, two AK-47s, eight women, and at least 23 children.	reverse_entailment	0.8
background	light	David A. Basskin, President and CEO of CMRRA, with a professional law <x>background</x>, stated in a sworn affidavit that his organisation made numerous attempts over the last 20 years to reduce what is known as the 'pending list', a list of works not correctly licensed for reproduction; a list of copyright infringements in the eyes of the Baker legal team.	Several items are banned in Molossia, including firearms, tobacco and incandescent <y>light</y> bulbs.	independent	1.0
sea	waters	It was carrying 220 tonnes of cargo according to the General Authority for the Red <x>Sea</x> Ports.	The plane, by then in Canadian airspace, tried to reach Halifax Airport but never made it, hitting the <y>water</y> at around 9:31 p.m. at 350 mph (563 kph).	forward_entailment	1.0
bride	marriage	More information on Mormonism: Photos showing Fundamentalist Church of Jesus Christ of Latter Day Saints (FLDS) leader Warren Jeffs with child <x>brides</x> were entered into evidence Friday in a Texas court case involving children seized from the Yearning For Zion (YFZ) Ranch by State authorities in April.	The Supreme Court ruled on Wednesday that the condition 'legitimated by <y>marriage</y>' results in unreasonable distinctions to violate Article 14 of the Constitution of Japan, which guarantees equality under the law.	other-related	1.0
burning	torch	The nine injured were taken to Fengxian District Central Hospital, where one was transferred to Ruijin Hospital with <x>burns</x> and another to Shanghai No.	Some 7,500 cars and dozens of buildings including schools and businesses have been <y>torched</y> since the violence began.	other-related	0.8
picture	camera	The 2004 photo previously showed the most distant galaxies, but the new infrared <x>pictures</x> from the WFC3 allow even more remote galaxies to be seen.	His statement 'claims he got the <y>camera</y> at a flea market, but was also offering other cameras on the Internet.' Source.	other-related	1.0
accident	fire	The <x>accident</x> is believed to be an explosion in a carbon canister containing radioactive material, which blew the seals out on Hot Cell	Outside the hospital, thousands of people gathered to demand Mubarak stand trial for ordering security forces to <y>fire</y> on protesters during the popular uprising earlier this year, when 800 people were killed.	independent	0.8
car	garage	Carroll was kidnapped in January when insurgents ambushed her <x>car</x> and killed her translator.	However, they were probably still covered with hairspray, which set alight the floor of the <y>garage</y>.	other-related	1.0
person	sponsor	According to BBC News Online, incidents like this usually cause one <x>person</x> to die from causes related to radiation.	Wikinews: What are your visions for the future of Frugalware, do you plan to globally distribute it as a product, and would you consider allowing a major corporation to <y>sponsor</y> your efforts?	independent	0.8
conversation	talk	In the 31-minute audio-recording there are <x>conversations</x> between the cockpit, air traffic control and other aircraft in the vicinity.	You <y>talk</y> about the film 'Poltergeist' and how your husband compared it to his experience of pulling you out of your psychosis (p. 219).	other-related	0.4
field	lot	However, Johnson fell behind after a caution on lap 218, and dropped back further into the <x>field</x> after another caution on lap 229.	He helped a <y>lot</y> of people.	independent	1.0
bowl	container	This may not be the last rolling rally Boston will see this year, currently the Foxborough, Massachusetts based American football team New England Patriots are currently undefeated in the NFL and appear at this time to be headed to another Super <x>Bowl</x> and possibly to becoming the second NFL team in the league's history to go undefeated an entire season.	The ship wrecked on December 9, 2005, near the Faial Island, due to bad weather conditions, and had in its manifest some <y>containers</y> considered dangerous.	independent	0.8
girl	woman	Not only 'Mayday Fans Meeting' at September 16, Microsoft Taiwan also invited Yulon Dinosaur Basketball Team players Hsueh-lin 'Iverson' Li and Chih-chung 'Virus' Chen have friendship matches with a 17-year-old <x>girl</x> player Shih-ching Wang.	Some nations wanted the U.S. to reduce prison overcrowding, prevent racial profiling, and ratify international treaties protecting the rights of <y>women</y> and children.	alternation	0.4
father	kid	In his first Christmas address as Australia's Prime Minister, Kevin Rudd called on his nation to drive safely during the holiday season, noting that his <x>father</x> was killed in a vehicle collision in the late 1960s.	The site links to BT's 'Green X Code' of conduct which encourages <y>kids</y> to stay safe while accessing the Internet.	alternation	0.8
aircraft	plane	The <x>aircraft</x> was on flight 5B138 and registered 5N-BIG. It sustained some damage in the accident, and two passengers were treated for minor injuries at the airport.	Amsterdam has been cut off, with <y>planes</y> grounded, and the train system from Amsterdam city halted.	reverse_entailment	0.8
daughter	father	Abdullah, Endon's mother Datin Mariam Abdullah, her two children Kamaluddin and Nori, <x>daughter</x>-in-law Azrene Abdullah, son-in-law Khairy Jamaluddin and her four grandchildren (who are Kamaluddin's children) were by her side as she breathed her last.	Ion's <y>father</y>, who is a senator from the Social Democratic Party, urged the Parliament to take a stand on the kidnappers' demands.	alternation	1.0
car	garage	Kimi Räikkönen struggled with the <x>car</x> this weekend, but ended up finishing the weekend with a fourth place.	The car was found later parked in the courthouse <y>garage</y>.	other-related	0.8
ball	basketball	Gibbs went on to score 110 runs from 100 <x>balls</x> and South Africa reached the target with just under eleven overs to spare.	Ask top tennis players Rafael Nadal and Roger Federer, ask the NHL players, ask the NBA <y>basketball</y> players.	other-related	0.4
edge	mountain	The officers, standing near the <x>edge</x> of the exclusion zone, suffered injuries to their necks and ears when they were blown over by the blast.	There is evidence of glaciers growing in the neighboring Karakoram <y>mountain</y> range.	independent	0.8
hill	mountain	In a press conference held on Thursday, Defence Minister Robert <x>Hill</x> said that Hicks would probably be discussed, however he is not on the agenda.	The discovery comes after an extensive search by <y>mountain</y> rescue teams, following Todd's unexpected absence.	independent	1.0
building	palace	Iran's statements came as Europe and the U.S. began to <x>build</x> support for reporting Iran to the U.N. Security Council.	Between June 1 and the end of August this year, the city will be flooded by herds of decorated cow sculptures, exhibited at well-known landmarks, such as The <y>Palace</y> of the Parliament, Europe's largest building, as well as on the streets and outside metro stations.	independent	1.0
baby	child	They also said both Kaplinsky and the <x>baby</x> are doing fine.	But she is a single mother with four <y>children</y> and she does not want to uproot her family and start over again.	forward_entailment	1.0
fun	play	Another French satirical weekly, 'Le Canard enchaîné' did not publish the Jyllands-Posten Muhammad cartoons because they were, according to it, 'not very <x>fun</x> and not very original', but published series of cartoons mocking Islamists (those exploiting the Muslim faith for political purposes).	Online entertainment is a booming market, and plenty of players are making their <y>play</y>; back in March of this year The Walt Disney Company bought the multi-channel network Maker Studios.	independent	0.8
fish	sea	The trawler was transporting <x>fishing</x> goods from Yemen to Oman when it was hijacked off Somalia's coast.	The body of bin Laden was buried at <y>sea</y>.	other-related	0.8
aircraft	base	Despite the <x>aircraft</x> being forced to turn around, the pilot did not request a priority landing and so Qantas refused to describe the event as an emergency landing.	The next Atlas launch is scheduled to occur in early July, with a DMSP weather satellite, from Vandenberg Air Force <y>Base</y> in California.	other-related	0.8
gun	weapon	Related stories The involved provinces and surrounding area of Thailand and Malaysia Wikipedia has articles on and the involved provinces, See also Two years on from the raids that signalled the start of what is generally accepted to be a separatist campaign in the south of Thailand, military forces in the area remain on alert for a repeat of the daring raid that saw four soldiers killed and over 400 <x>guns</x> stolen.	Barry Venable said white phosphorous munitions were used as an incendiary <y>weapon</y> against enemy combatants.	forward_entailment	0.8
girl	person	The Facebook page has also promoted women's participation and profiles of women's players as recently as a month ago, when on April 9, it promoted the <x>Girls</x> 'Come and Try' Day in Canberra.	Daning is the highest ranking <y>person</y> executed in China since 1999, when a Major General and Senior Colonel were executed for selling state secrets.	forward_entailment	1.0
swimming	water	On April 22, 2007, a 40-year-old woman from Milan <x>swam</x> naked in the fountain, getting her picture into international newspapers.	Other <y>water</y>-bearing minerals found earlier are phyllosilicates and hydrated sulfates.	other-related	0.6
clean	water	Processing and countdown progressed smoothly, and were described by 'Discovery's' processing and launch flow director, Stephanie Stilson, as being 'a very <x>clean</x> flow'.	According to police statements, members of 1 Mind Ministries refused the boy food and <y>water</y> because he did not say 'amen' after group meals.	independent	0.8
break	trip	Scuffles <x>broke</x> out between Sunni and Shiite students, who were respectively support and oppose of the current government, in the university's cafeteria and soon attracted local supporters of both groups.	Evans often offered odd jobs to the teens and Hampton said Evans brought the youths in two <y>trips</y> to the vacant Camden Street house on the pretense of helping move boxes.	independent	1.0
edge	mountain	After months of campaigning, Johnson <x>edged</x> activist R. Lee Wrights on the first ballot with 70 percent of the 595 convention delegates.	Wikinews How have you been doing here Copper <y>Mountain</y> so far?	independent	1.0
ball	toy	In the 1970s, his World Series Cricket revolutionised cricket, bringing One-day cricket to the fore by introducing things such as coloured uniforms, white <x>balls</x> & day/night matches.	Mattel, the world's largest <y>toy</y> producer, recently launched a massive product recall of Chinese-made products because their paint may contain excessive amounts of lead.	independent	0.4
accident	fire	The <x>accident</x> occurred at 21:10 local time at the Yucai Middle School, a privately-run institution in city of Xiangxiang, located in the Hunan Province.	Edited text of ETA cease-<y>fire</y> statement. '(Translated/edited from Spanish by Wikinews)' Euskadi Ta Askatasuna (ETA) has decided to declare a permanent cease-<y>fire</y> from 00:00 AM on the 24 of March 2006.	independent	0.8
child	daughter	50 bodies were recovered during the ceasefire, raising the death toll to 763, including more than 200 <x>children</x>, since air raids first began on December 27.	Her mother also gave evidence to say Mitchell had called her to discuss the <y>daughter</y>'s drug-addict boyfriend.	reverse_entailment	1.0
cop	policeman	What kind of advice have you given to people <x>coping</x> with the disease?	On Thursday, a bomb blast at a police checkpoint wounded at least two <y>policemen</y> in the northwestern city of Peshawar.	independent	0.8
father	kid	Chris Coker, Brad Coker's <x>father</x>, has urged NZ Prime Minister John Key to increase regulation.	Back in 2009 he was sued by his former General Manager Elgin Baylor who criticised Sterling's attitude and quoted him as saying 'I'm offering you good money for a poor black <y>kid</y>' when negotiating a contract with .	alternation	0.8
lady	woman	The newspaper has acknowledged that the idea may not work, saying 'Plenty of skeptics are predicting embarrassment; like an arthritic old <x>lady</x> who takes to the dance floor, they say, the Los Angeles Times is more likely to break a hip than to be hip.'	OSC chose to play Åbyhøj Squash Klub (ÅSK) in the first semi final, and beat them with ease 6-1, only loosing the <y>women</y>'s second to Ditte Nielsen (ÅSK).	equivalence	1.0
baseball	hit	However, as Soriano played with the Dominican Republic in the World <x>Baseball</x> Classic, Monday was the first day that he was scheduled to play for the Nationals during spring training.	AEST (UTC+10), a maintenance hatch blew from a train travelling North on the Harbour Bridge <y>hitting</y> overhead lines and landing in northbound traffic lanes.	independent	0.6
fish	sea	A 375 million-year old fossilised umbilical cord indicates that placoderm, thought to be ancestors of modern <x>fish</x>, are actually closer to sharks and rays.	Ukraine has threatened to retaliate by raising the rent that Russia's navy pays to use the Ukrainian port of Sevastopol as headquarters for its Black <y>Sea</y> fleet, and refusing to repair Russian rockets, which can be repaired only there.	other-related	0.6
game	play	The <x>games</x> are considered a matter of national prestige and generate more media attention than the recent changes in Russian government (Russia’s Putin recently installed the new prime-minister, who, incidentally, also became the chair of the Russian Olympic committee.)	The father of the deceased boy said that his children had been watching the video of Saddam Hussein's execution on television and attempted to imitate the hanging as other family members thought they were <y>playing</y> in another room.	other-related	0.6
boat	ship	However, Captain Paul Watson says political pressure from Japan is behind the detention of the <x>boat</x>.	Allowing the CIA to have so much power in deciding who can stay in the country and who is <y>shipped</y> off to other countries is controversial, because in the past, the White House, State Department, or Justice Department would have been involved in approving individual cases of sending prisoners to other countries.	independent	0.8
