kid	toddler	The documentary, entitled 'How The <x>Kids</x> Took Over', investigated the increase in marketing to children, who 'have a say' in AU$700 billion worth of spending each year.	I have elderly parents and a <y>toddler</y> daughter so I can relate to the issues that affect a wide range of age groups.	reverse_entailment	1.0
building	palace	However, Senator David Vitter, R-LA, who is a supporter of the bill says, 'we're <x>building</x> votes.' 'Most Americans are not yet convinced that their elected representatives or the judiciary are likely to expand decisively the definition of marriage to include same-sex couples,' said John McCain (R-AZ) who opposed the bill.	It is understood he destroyed the Namdaemun gate and attacked the <y>palace</y> over an unconnected land ownership dispute which had angered him.	independent	0.8
fun	play	We want to make it <x>fun</x>, a place where people can learn the Indian stories,' a place that can appeal not only to Hindus but people of other religious faiths as well. '	Manchester also will be <y>playing</y> their European charity match beforehand, which takes place on the 13th.	other-related	0.6
ocean	surf	However, Clausen believes that there are no current systems to remove oil from icy <x>ocean</x> waters.	Diego Medina, also Chilean, received the Big Drop and <y>Surf</y> Spirit awards, recognition given by the other competitors.	other-related	1.0
adult	mother	Among the injured were six <x>adults</x>, most who have yet to be identified.	03 The Belgrade Neonatology Institute has refused to hand over a child to her <y>mother</y>, after she was unable to pay her medical bills.	reverse_entailment	0.8
play	rest	He had served 58 games of the 92 he has <x>played</x> as the national captain.	India preferred to <y>rest</y> Sachin Tendulkar and Irfan Pathan.	independent	0.6
bird	fly	For the moment, all <x>birds</x> in the zoo have been confined to their cages and viewing of <x>birds</x> by the public is no longer permitted.	They will then make their way to schools, take a break through the Christmas season, and <y>fly</y> to Ottawa for the Winterlude festival.	other-related	0.6
official	person	Many of these fires have now been contained, <x>officials</x> say.	Dannatt was regarded by many soldiers as a <y>person</y> to be admired, having campaigned for better pay and conditions for soldiers.	forward_entailment	1.0
daughter	father	Her son, three-year-old Aubarr Aziz and her <x>daughter</x> Chanarra, aged two, were discovered alongside her and were also found to be dead.	When I was young, I heard from my <y>father</y> that such rain had fallen in the early '40s on the outskirts of northern Baghdad but snow falling in Baghdad in such a magnificent scene was beyond my imagination.' Fawzi Karim, who runs a small restaurant in Hawr Rajab, six miles from Baghdad said 'I asked my mother, who is 80, whether she'd ever seen snow in Iraq before, and her answer was no...	alternation	1.0
play	rest	Competing in national competitions, does classification come into <x>play</x>, especially when there is so few women skiers in your group?	Afterward, at 11:30 am, all fears of the tsunami were put to <y>rest</y> as the Willis Islands reported no tsunami.	independent	0.6
spray	water	In March 2007, Swiss national Oliver Jufer was convicted of lèse- majesté and sentenced to 10 years for <x>spray</x>-painting on several portraits of the king while drunk in Chiang Mai, Thailand.	Astronomers say this makes it possible to not only support life, but have liquid <y>water</y> in the forms of oceans.	independent	0.8
pose	stand	Maningrida 'certainly suffered extensive damage to some buildings and structures,' she told the Sydney Morning Herald, although no serious injuries have been reported Tropical Cyclone Monica now <x>poses</x> no risk to the Northern Territory of Australia.	Present President Joachim Gauck said von Weizsäcker '<y>stood</y> worldwide for a Germany that had found its way to centre of the democratic family of peoples.' With his father Ernst a defendant at the Nuremberg trials, Richard von Weizsäcker appeared before the court as a lawyer for his father's defence.	independent	0.8
people	police	According to the latest statistics of the WHO on its website, some 418 <x>people</x> in 15 countries and regions have contracted the virus and 257 of them died of the disease.	<y>Police</y> suspect he may be on the run and are trying to trace him as well as a black and white Mercedes car he may be driving.	reverse_entailment	1.0
coat	jacket	Wearing a silicon-<x>coated</x> wetsuit, Trubridge plunged into world's deepest blue hole in a bay west of Clarence Town on Long Island, Bahamas.	Officials believe that the shooter at Norris Hall was an Asian male in his 20s who was wearing a maroon cap and a leather <y>jacket</y>.	independent	0.8
gear	outfit	When the plane crash-landed, its landing <x>gear</x> had not been released, according to firefighter Ilda Pineda.	The group was clad in a variety of <y>outfits</y>, ranging from street clothing to drag to camp gear; some wore make-up or fake moustaches.	independent	1.0
bank	market	Yunus, from Bangladesh, said 'We want the same kind of unity in politics like the unity that has been created by the Nobel prize award,' at a press conference at the <x>bank</x>'s office in the suburbs of the Bangladeshee capital, Dhaka.	Xinhua reported Linux based operating systems are in development for the Chinese <y>market</y>, and the announcement presents business opportunities for those working in the information technology sector.	other-related	0.6
boy	horse	Once it landed, the plane was searched, passengers were questioned, and the tefillin was examined by the bomb squad and proven to be harmless. 'The <x>boy</x>, who is from White Plains, and was traveling with his 16-year-old sister, was very cooperative,' Philadelphia police Lieutenant Frank Vanore told local media.	A 2 dollar wager on the winning <y>horse</y> Giacomo paid $102.60.	independent	1.0
baseball	football	Squash, karate and roller sports tried to get onto the Olympic program as well as <x>baseball</x> and softball, which were voted out of the Olympic Games in 2005.	One minute of silence was held at the beginning of the <y>football</y> match between Chile and Mexico in Barcelona, on Sunday.	alternation	1.0
chicken	meat	More than 25,000 <x>chickens</x> had died in poultry farms in the district over the past 10 days, district official Jayant Gaikwad said.	<y>Meat</y> from whales killed for research is later consumed at Japanese restaurants.	forward_entailment	0.8
person	people	He continued, 'Ironically, if this lawsuit were to succeed the net effect would be to deal a double blow to civil rights - by significantly reducing access to equal opportunity housing, and by undercutting our fundamental free speech rights - thereby doing a great disservice to the very <x>persons</x> these lawyers purport to represent.'	Mahmoud Zahar, a senior Hamas official, commented that 'Hamas has gone from stone-throwing to guns and rockets, from a support base of a few thousand <y>people</y> to a backing of millions in Arab countries and around the world.'	equivalence	0.6
horse	vehicle	Flight KL685 carried 287 passengers and 15 <x>horses</x>, all of whom had to put up with a day's delay, and among the passengers, 'Frederic Hennekens', a lawyer from Antwerp.	Ronaldo was not injured during the crash and no other <y>vehicles</y> were involved.	independent	0.8
climb	play	Hewitt was the 2002 champion, but in recent years has slipped down the rankings, leaving the Top 100 last year whilst suffering from a knee injury, only <x>climbing</x> back up to 58 currently.	We <y>played</y> for the love of the game.	independent	1.0
father	kid	This was Tiger's first tournament since his <x>father</x>'s death on May 9, although he said in a press conference that there was no excuse for his awful playing.	I want to be able to enjoy my <y>kids</y>.	alternation	0.8
field	playing	The structure of BT's privatisation, and breakup to permit level playing-<x>field</x> telephony and broadband competition, would see other Internet service providers who rely on the ageing, once GPO-owned, copper POTS infrastructure unable to resolve customer faults.	In protest, players wore their warm-up jerseys inside out before their Game 4 playoff loss against the Golden State Warriors, while in other games throughout the league the San Antonio Spurs <y>played</y> in black socks and the Miami Heat practiced with their warm-up shirts inside out to mimic the LA Clippers.	independent	0.8
boy	family	An eight year old <x>boy</x> was signed up with the Sea Org (Billion Year Contract) and he was put to work scrubbing pots and pans from that young age.	An outspoken former national soccer champion, Mr. Hassan Naeb Agha, an active member of the opposition, claims to have been approached by <y>family</y> members under influence of Iran Ministry of Intelligence (MOIS) in a psychological warfare in an attempt to penetrate his personal life to stop his activities.	other-related	0.6
band	play	Q: The <x>band</x> has sung at concerts with many noted names, and on quite a few television series.	Iraq was scheduled to <y>play</y> Australia in a 2010 FIFA World Cup qualifier in Brisbane on Sunday then again in Dubai next week and if they miss those matches, Australia would be given the points.	independent	1.0
girl	person	Jeffs, a recluse, was indicted last June on a sexual misconduct charge in Arizona; prosecutors allege he arranged marriages for under-age <x>girls</x> and older men.	The jetliner, which was carrying 273 people according to an airport spokes<y>person</y>, was flying Flight 782, which travels from Toronto to Karachi, when it was diverted to in after Canadian officials were informed that a passenger had explosives on his <y>person</y>.	forward_entailment	1.0
oil	water	The fuel/<x>oil</x> heat exchanger is a dual purpose part designed to simultaneously melt fuel ice and cool down engine <x>oil</x> by passing <x>oil</x> pipes through the fuel flow.	CQ Politics noted, 'two issues — whether Thompson has raised more money than could be expected to be used for exploratory activities, and whether his months of 'testing the <y>waters</y>' have been a 'protracted period of time' as outlined by federal law as qualifying someone as a candidate — Thompson could have trouble.'	alternation	0.8
hit	play	The S&P 500 was also <x>hit</x> hard, losing 39.45 points, or -2.56%, closing at 1,500.63.	West Virginia <y>plays</y> #4 seed Louisville at 4:40 PM EST tonight, while #3 seed Arizona <y>plays</y> #1 seed Illinois at 7:05 PM EST.	independent	1.0
music	perform	Opponents contend that the bill, depending on how it is amended in the French Senate, could in effect criminalise the writing of players compatible with new online distribution formats for <x>music</x>, video or even text, and thus make such content unplayable on systems such as Linux, thereby generating a monopoly for established suppliers.	According to Campbell, autopsies will be <y>performed</y> on two of the fifteen dead whales.	independent	1.0
earth	rock	The rocket, which is the first privately-funded liquid-fueled launch vehicle, was intended to place the payload into a low-<x>Earth</x> orbit, but all contact with the rocket was lost just over five minutes into the flight.	As on Earth, the most plausible explanation of the presence of salt water is the prolonged contact of liquid water with mineral bearing <y>rocks</y>.	independent	0.6
person	people	There are no reports of deaths, but at least one <x>person</x> was injured in a building collapse.	Jowell continued, 'Each one casts a shadow just as they do - each one standing tall and proud just as they did, and each one will in an individual way absorb and reflect light just as they did.' A 1.4 tonne stainless steel plaque with the names of the <y>people</y> killed was also unveiled.	forward_entailment	0.6
clothing	uniform	The retaliatory tariffs will largely affect U.S. paper, <x>clothing</x> and machinery for the EU and live swine, cigarettes and oysters for Canada.	Salim Razaq, described by his Assistant Chief Constable Andy Cooke of Lancashire Constabulary as 'nothing short of a criminal in a police <y>uniform</y>', received eleven-and-a-half years imprisonment on Tuesday after being caught during a 'turf war' with a rival gang.	reverse_entailment	1.0
rail	slide	Although the streets are navigable, the Long Island <x>Rail</x> Road (LIRR) is a different story:	Some residents in the area had to leave their homes after a mud <y>slide</y> came down Friday evening.	independent	1.0
stick	tree	There was a dramatic pause as delegates waited to see if Smith would <x>stick</x> around for the second ballot or free his delegates.	His injuries suggest that he dragged the child across the ground, kicked him in the face, tied him to a <y>tree</y> and struck him with a brick.	independent	1.0
person	woman	The Wikimedia Foundation funded the assistance in Iberoconf of two <x>persons</x> per group.	The victims, a 28-year-old man and a 20-year-old <y>woman</y>, were found in the Fine Arts Building of Henry Ford Community College in Dearborn, Michigan.	reverse_entailment	1.0
piece	strip	A <x>piece</x> in 'iVillage' noted Travolta had been pressured for years to speak out publicly about his son Jett's autism.	The pact had begun to fail weeks ago with tit-for-tat attacks across Israel's border with the Gaza <y>Strip</y>.	independent	1.0
box	tape	Google Suggest is also available as a separate extension that works with the standard Firefox search <x>box</x>.	The <y>tape</y> also shows her making abusive comments about other contestants, such as Carrie Underwood, who has gone on to have some success.	independent	1.0
hands	person	One described asking RUF rebels to sever his only <x>hand</x> in exchange for his young son's life.	The Kuwait News Agency (KUNA) reports that a hospital in the region has confirmed at least five <y>persons</y> were killed in the attacks, and over fifty more were injured, including a young Moroccan girl.	other-related	0.8
play	practice	They can be seen fighting and <x>playing</x> all around the dock in the harbor.	The bill would extend health insurance coverage to 30 million US residents who currently lack it, and forbid insurance companies from <y>practices</y> such as denying coverage due to pre-existing conditions.	independent	1.0
kid	woman	They had their entire lives ahead of them — birthdays, graduations, weddings, <x>kids</x> of their own.	A representative warned: 'The new quotas will lead to higher prices and less choice for European consumers when they try to buy trousers, pullovers, <y>women</y>'s blouses, brassieres and other textile products in the coming months.'	alternation	0.8
class	classroom	In 1996, Kasparov was at the top of his game, when a team led by IBM introduced Deep Blue, the strongest of a new <x>class</x> of chess playing computers.	The school has installed RFID detectors at the doors of seven <y>classrooms</y> as well as the bathrooms, though they claim that the bathroom units were not turned on, and subsequently been removed after complaints from parents.	independent	1.0
garage	parking	He came into the mall from the parking <x>garage</x>.	Chee Kian Jeff Chan, 28, was forced by three people into a black Mercedes SUV (which was caught on security camera) in the <y>parking</y> garage of his condominium at 23 Oneida Cresant in the Yonge Street and High Tech Road area.	forward_entailment	0.4
ball	toy	Hail storms have smashed windows in New South Wales, with stones as large as cricket <x>balls</x> reported in Crookwell with large hail also reported in Wagga Wagga.	His works have served as reference for animators, and as prototypes for <y>toys</y>.	forward_entailment	0.6
marriage	marry	Here is the deleted portion of the transcript: Ken Mehlman, currently the chair of the National Republican Committee, has been known to avoid questions about his sexuality, and supports a constitutional ban on same sex <x>marriage</x>.	He was <y>married</y> three times and is survived by sons Jeffrey, Jes and Jackson Dryden.	equivalence	0.6
clothing	vest	Six people have died after a <x>clothing</x> store was set on fire during an armed robbery in Bridgetown, Barbados.	The other bullet hit her bullet proof <y>vest</y> and did not cause any damage.	reverse_entailment	1.0
car	jeep	The La Cruz Hill was flooded with <x>cars</x> and people crying.	Just one day after a car bomb was defused in central London on June 29, a <y>Jeep</y> was driven into the Glasgow International Airport terminal and burst into flames in an unsuccessful terrorist attack.	reverse_entailment	1.0
mountain	top	The match was included in an overall Australia Day celebration at Buderim <x>Mountain</x> State School which included Sunshine Coast Idol, kids' rides, barbecues and food stalls.	Chief Acevado said that there were 'reports of a second suspect that was wearing a beanie with a long rifle, wearing blue jeans and a black <y>top</y>' that 'may or may not be a white male.'	independent	1.0
bottom	top	Sen. Craig also ran his hand along the <x>bottom</x> of the stall's dividing wall.	Prime Minister Stephen Harper is currently at the <y>top</y> of charts for iTunes.	alternation	1.0
lady	woman	President Obama and the First <x>Lady</x> announced that they were 'saddened at the loss.'	Despite the slow speed of the train, the driver was unable to stop the train before it ran over the <y>woman</y>.	forward_entailment	0.8
front	hand	The centerpiece of the archive's museum is a wax figure of Pestonji, seated with his prized Mitchell camera in <x>front</x> of a recreation of the set from his 1957 musical comedy 'Country Hotel'.	Wikinews' Gabriel Pollard was on <y>hand</y> to record the 'Christchurch March for Democracy' protest and the views of those marching.	independent	1.0
stick	tree	The U.S. National Transportation Safety Board (NTSB) has determined that the captain of Colgan Air Flight 3407, which crashed nearly a year ago outside Buffalo, New York during its approach to Buffalo Niagara International Airport, 'inappropriately responded to the activation of the <x>stick</x> shaker, which led to an aerodynamic stall from which the aeroplane did not recover,' according to a statement issued by the NTSB.	Wasson also says the impact that created the jewel can be compared to the 'Tunguska event' that occurred in Tunguska, Siberia in 1908 causing at least 80 million <y>trees</y> to be flattened, but left no visible impact crater.	independent	1.0
baseball	football	His last sit down interview which occurred on January 6, 2007 was with <x>baseball</x> star Roger Clemens.	The match had good passing, inventive plays; both sides played with three defenders and encouraged attacking <y>football</y>, with much of the play in and around the penalty areas.	alternation	1.0
obstacle	railing	This is not Sunderland's first <x>obstacle</x> during the journey.	Police searching for the cause of yesterday’s disaster investigated eight offices of West Japan Railway Co on Tuesday for clues to the <y>rail</y> driver.	independent	1.0
conversation	talk	He also states that he would not mind a one-on-one <x>conversation</x> with some members of 'Anonymous', but 'these guys don’t have the balls for a direct sit-down because they should get their facts straight.'	He <y>talks</y> about an extensive US stimulus campaign.	equivalence	0.4
board	panel	Falcon Heene, a 6-year-old boy from Fort Collins in the US state of Colorado, has been found safe and unharmed after earlier reports said he <x>boarded</x> an experimental balloon the family was building and then floated away.	James Robertson, a former <y>panel</y> judge member of the Foreign Intelligence Surveillance Court, resigned in protest over the murky question of the constitutionality of the NSA eavesdropping on international telephone calls and e-mail, which bypassed the jurisprudence of that court.	independent	1.0
photograph	photo	NASA's Lunar Reconnaissance Orbiter recently <x>photographed</x> similar landforms in other locations on the moon, further supporting the theory that Earth's closest neighbor in space may in fact be shrinking.	Former president of FUNAI, Sydney Possuelo, agreed that the publication of the <y>photos</y> was necessary to quell the doubt about the very existence such uncontacted indigenous peoples.	other-related	0.6
hands	person	Following the publication of the postmortem, an American tourist <x>handed</x> over film footage of the moments leading up to Ian Tomlinson's death to 'The Guardian' newspaper.	He added that Whittington was 'a lucky <y>person</y>' to survive the shooting.	independent	0.8
piece	strip	This year, one <x>piece</x> breached the $1,000 mark in the PG category - 'Just one more', by California artist 'Dark Natasha'.	Sharon had cut all links after a suicide attack killed six Israelis at a Gaza <y>Strip</y> border entry point, just days after Abbas has been elected leader.	independent	1.0
beach	water	Fishermen took their boats away from the <x>beach</x>.	In a recent statement from the organization, forecasters noted that 'There is a short window available for any further intensification', but the storm is likely to weaken once it moves over cooler <y>waters</y>.	other-related	0.8
building	space	Sar Sareth, director of PMTair, told the Associated Press yesterday that he did not know what year the crashed plane was <x>built</x>.	The same worker allegedly damaged another computer that was not bound for the <y>space</y> station.	independent	1.0
guy	woman	Do you think you <x>guys</x> have, you and Melissa can pick up a medal, and you get a medal?	The Paralympic host nation's <y>women</y>'s sitting volleyball team lost to Ukraine earlier today at London's ExCel—South Arena 2, in straight sets, before a crowd of enthusiastic supporters.	alternation	0.8
lady	woman	Former First <x>Lady</x> of the United States Betty Ford died Friday at the age of 93.	While San Antonio Mayor Julian Castro, <y>women</y>'s health advocate Sandra Fluke, and Harvard Law professor Elizabeth Warren all formally introduced themselves to the national audience at the 2012 Democratic National Convention, they were not the only figures to do so.	equivalence	0.6
building	space	Indonesia's President has said efforts to <x>build</x> an early warning system planned after the 2004 Asian tsunami are to be accelerated.	The moons were discovered in May last year by the Pluto Companion Search Team, a team of scientists from the Southwest Research Institute (SwRI), the Johns Hopkins University's Applied Physics Laboratory (APL), the <y>Space</y> Telescope Science Institute and Lowell Observatory, using images taken from the Hubble space telescope.	independent	1.0
clothing	uniform	The board of Lindex is said to have recommended acceptance of the deal, which significantly outdid a 7 billion kronor (€763 million; US$1.08 billion) offer by rival KappAhl Holding AB, another <x>clothing</x> vendor, in August.	Aidan Burley, the Conservative Member of Parliament for Cannock Chase in Staffordshire, England, has been forced to leave his job as a Parliamentary Private Secretary to Justine Greening in the Department of Transport after pictures appeared in 'The Mail on Sunday' newspaper showing him at a stag party in France with a man dressed in the <y>uniform</y> of a Nazi SS officer.	reverse_entailment	1.0
bird	fly	Assistant Director-General of the World Health Organization and top <x>bird</x> flu expert, Doctor David Heymann, says a team of WHO experts has completed an investigation into an outbreak of <x>bird</x> flu in Pakistan.	<y>Flown</y> in to mediate the crisis, Annan led the two sides to a power-sharing agreement that made incumbent candidate Mwai Kibaki president and his rival, Raila Odinga, prime minister.	other-related	0.6
rail	slide	The country's worst <x>rail</x> disaster, however, was in February 2002, when at least 361 were killed after a passenger set fire to a moving train while using a stove.	The bolt in question is mounted to the main slat tracks, on which the slats <y>slide</y> back and forth.	independent	1.0
class	classroom	For all but two years, he was the only black in the largely white, working <x>class</x> group, and became a key influence in Springsteen's music as well as a trusted companion.	In December 2005, following legal case between the parents and the school district of Dover (Pennsylvania, USA), the judge decided that intelligent design was a religious view, and that it was unlawful to teach it as an alternative to evolution within the <y>classroom</y>.	independent	1.0
plastic	toy	The homemade device, which consisted of explosives placed inside a <x>plastic</x> bag and tied to a pole close to the target, damaged the Hellenic Public Real Estate Corporation building.	The <y>toy</y> was recently named Australia's number one <y>toy</y> for 2007.	other-related	0.6
seat	ground	In the election of 2006, his party won 9 <x>seats</x> in the Dutch parliament which has 150 <x>seats</x>.	In March, there were fights during and after a game between the Bulldogs and Wests Tigers at Telstra Stadium, the Bulldogs home <y>ground</y>.	independent	1.0
hockey	play	Other placements include Joe <x>Hockey</x> MP as treasurer, Malcolm Turnbull MP as Minister for Communications, and Barnaby Joyce MP as Minister for Agriculture.	DS: Are there any bands you guys would love to <y>play</y> with?	independent	1.0
piece	strip	In addition to Ortega, former Scientologists Marc Headley and his wife Claire were interviewed by ABC News for the '20/20' <x>piece</x> which they were informed would be complemented by a news segment on 'Nightline'.	In January 2006, Robertson said that former Israeli Prime Minister Ariel Sharon's stroke was 'divine retribution' for pulling Israelis out of the Gaza <y>Strip</y>.	independent	1.0
