opponent	player	The approval ratings of UK Labour leader Ed Miliband rose above those of his Conservative <x>opponent</x>, David Cameron, for the first time in this year's bitterly fought general election campaign.	Following its recent loss to South Africa, the Australian Cricket team has replaced <y>player</y> Jason Krejza for Nathan Hauritz in the traditional Boxing Day test to be played at the Melbourne Cricket Ground in front of an expected crowd of 70,000.	forward_entailment	0.4
photograph	camera	It was celebrated by the victorious fighters who <x>photographed</x> themselves with the captured equipment.	It's an optical illusion that looks like it's going up, whereas in reality it's going towards the <y>camera</y>.	other-related	1.0
beer	glass	The ad, which Alex Williams of SiliconANGLE described as 'bizarre' and 'misogynist,' was quietly changed on Eventbrite by Sqoot, removing the mention of women as <x>beer</x> peddlers.	The officer took her to a nearby pub where he had been drinking; later, he said he got her a <y>glass</y> of water, after which she vomited.	independent	0.6
hit	swing	Bloggers appear to be creating entries containing the terms to increase <x>hits</x> to their blogs.	There is fluency about Sreesanth's run-up and action that is hard to ignore, and he did bowl well at the death, <y>swinging</y> the ball into the right-hander.	independent	1.0
band	play	The idea to the video is just as wild as the cover song itself: a battle metal <x>band</x> covering a 70's disco hit.	A native of Houston, Texas, Preston <y>played</y> while in his teens with Mahalia Jackson, Little Richard and Ray Charles.	other-related	0.8
fishing	water	A <x>fishing</x> boat has capsized off of South Korea's southern coast, killing at least ten passengers.	The prisoners' allegations include their captors using <y>water</y> torture techniques and inserting large nose tubes to deliver food.	other-related	0.6
audience	person	Local entertainers remember him for his ability to connect with his <x>audience</x> as well as his laid-back, mumbled delivery that became his signature.	Some other <y>persons</y> criticked the program, in private after the fall of the regimen of Saddam Hussein, under the argument of that Saddam took advantage of the profits obtained by the sale of oil for maintain itself através of a plan of corruption that implicava staffs of several governments and of the UN. France, Russia and China defended the expansion of the program.	forward_entailment	0.6
hill	mountain	Senator Robert <x>Hill</x> today moved that the laws, after introduction in the Australian House of Representatives, be referred to the Legal and Constitutional Legislation Committee, with the report date set November 8 -- the Senate resumes sitting on November 7, after Senate estimates have been taken place, leaving either next Friday or the weekend for the inquiry to take place.	The wireless network (Wi-Fi) covers 90% of <y>Mountain</y> View.	independent	1.0
fish	sea	Homeless people huddled together by the thousands in tents and cow pens are <x>fishing</x> and leaving by canoe to find food.	The US Geological Survey measured the quake at 7.6 on the Richter scale. 'The quake has no tsunami potential because it's happening under the ground, not the <y>sea</y>,' Waluyo said.	other-related	0.8
summer	weather	Despite hot <x>summer</x> temperatures, firefighters wore full safety gear including face mask and oxygen tanks as they tried to rescue her from the wreck.	The report is an analysis of radar records from the Federal Aviation Administration and the National <y>Weather</y> Service, obtained through several Freedom of Information Act (FOIA) requests, and comparing them to witness accounts.	other-related	0.6
field	lot	Google Checkout, a competitor to PayPal in the <x>field</x> of retail payment services, is notably absent from the list of accepted payment methods.	They have suffered a <y>lot</y>.	independent	1.0
bird	fly	Wildlife scientists confirmed on Thursday that a <x>bird</x> long thought extinct, the Ivory-billed woodpecker, has been found in Arkansas.	Four fighter jets from the Connecticut Air National Guard <y>flew</y> over the track after the national anthem, a NASCAR tradition for races.	independent	0.6
bride	couple	The license application will be identical to one for a regular marriage, except '<x>bride</x>' and 'groom' are replaced with 'party 1' and 'party 2.'	Afterwards, inside the White House, the first <y>couple</y> presented the Pope with a birthday cake.	other-related	1.0
picture	camera	Officials at Sony-owned Columbia <x>Pictures</x>, which distributed the film, expect the film to gross US$50 million to US$80 million during its first weekend in the United States, based on figures from early matinees on Friday. 'The early matinees are very strong and extremely encouraging,' said Steve Elzer, a spokesman for Columbia.	In addition, the impact was observed by <y>cameras</y> and spectroscopes on board Europe's Rosetta spacecraft, which was about 80 million km from the comet at the time of impact.	other-related	0.8
clean	erase	According to Xinhua News Agency, six central agencies, led by the Ministry of Public Security and Ministry of Industry and Information Technology, conducted an intensified month-long campaign to <x>clean</x> up the Internet of unhealthy, vulgar and porn materials.	In July, she falsely told reporters she was assaulted in her homeland which <y>erased</y> her credibility.	independent	0.8
aircraft	base	However, some limitations were found in the performing of the Russian <x>aircraft</x> in Italy's wildfire scenarios.	<y>Based</y> on one seismic model, some of the smaller islands southwest of Sumatra have moved southwest up to 20 m (66 ft).	independent	1.0
rail	slide	Road and <x>rail</x> traffic was disrupted by police as they investigated and removed the devices.	Around 10:30 a.m. ET, a cable <y>slid</y> over one tower's pulley leading to five chairs falling about 30 feet.	independent	1.0
sidewalk	street	The demonstrators sat on the <x>sidewalk</x> illegally, after marching along the pedestrian walkway on Pennsylvania Avenue in front of the White House.	While protesters were leafleting on the <y>street</y>, Lockheed alerted police to the demonstration.	alternation	0.4
clothing	uniform	Earlier in the week, an unidentified Internet blogger, who stated that they were an employee of music corporation Sony Music UK, claimed that the programme had been unfairly pre-arranged due to Parke allegedly being familiar with Cowell and Syco for two years, already having a record contract, as well as prior arrangements being made for his appearance, including his <x>clothing</x>, hairstyle and behaviour.	He did not obey instructions from police (not in <y>uniform</y>) as he ran onto a Tube train at the station.	reverse_entailment	0.8
garage	parking	As laid out in the book, she was instructed to reside in a parking <x>garage</x>, remove herself from family, and perform hard labor.	Their concerns were not about the showground itself, but the fact that patrons have to cross a highway carrying 27,000 vehicles per day unassisted to get from the main <y>parking</y> area to the showground.	other-related	0.6
beach	shore	The collapsing of the cliff, which was on a small <x>beach</x> and stretched 130 feet (40 metres), occurred at around 1600 GMT on Sunday.	DR. VAN HEERDEN: I don't think so, because right now they're really battling just to try and <y>shore</y> up the levees.	independent	0.6
black	grey	Shortly before 08:00 EET, a small plume of <x>black</x> smoke appears, left side of the live broadcast, an oil pipeline having sustained its first direct hit.	<y>Grey</y>'s Anatomy won the best international programme as voted by the public.	independent	1.0
ball	mitt	Unmarked in the centre of the goal it might have been easier to get the <x>ball</x> on target than to skew the volley so far wide.	On the Republican side, former Massachusetts governor <y>Mitt</y> Romney easily won both the Arkansas and Kentucky primaries with 68.3 percent and 66.8 percent, respectively.	independent	1.0
bank	river	In an interview with BBC News, Tony <x>Banks</x> stated his belief that the large Muslim population in the constituency had voted against Oona King 'because she is a black woman' and that he believed that George Galloway would have seen a far different result if he had 'come to West Ham'.	Areas also affected are along the <y>River</y> Severn, the <y>River</y> Teme, and the <y>River</y> Aire.	independent	1.0
play	practice	Griffin, who <x>played</x> college Basketball at Seton Hall University, <x>played</x> for the Houston Rockets from 2001–2003, and the Minnesota Timberwolves from 2004–2007.	Jana told reporters: 'I find it very difficult to give advice at all, but I can advise people to <y>practice</y> every day and to follow websites where there are a lot of games available.'	other-related	0.8
book	video	Then 'the first 150,000 people that come through (on the hotline) will be <x>booked</x> in' on the 1 April.	Throughout the night on a live <y>video</y> feed courtesy of the Palestinian news agency 'Ramattan', bombs were dropped and explosions could be seen and heard rocking the Strip.	independent	1.0
boy	child	One police officer and a seven-year-old <x>boy</x> have reported to be injured in the incident.	One placard declared, 'Killing <y>children</y> is not a 'measured response',' referring to the G8 statement released earlier.	forward_entailment	1.0
garage	park	One whimsically listed the job's benefits as '... free uniforms, a complimentary hair and makeup consultation and make-over, inspirational background music, plenty of on-the-job exercise opportunities and more.' Long a staple in American culture, 'Haunted Houses', as they're commonly called, range in size from small <x>garage</x>-sized projects, up to multi floor buildings outfitted with the most elaborate of lighting and special effects.	According to the city's local chapter of the environmental Protection Agency, lightning struck a pavilion at approximately 5:00 p.m. (Eastern time) at Hamonasset Beach State <y>Park</y>.	independent	1.0
field	lot	The victims were taken to medics and then flown to Kandahar Air <x>Field</x> Hospital where the ten year old died.	Money from the reception will go into a joint fund-raising account called McCain Victory 2008. 'Romney had a very powerful fundraising operation with a <y>lot</y> of donations coming out of this area, and of course now he can leverage that to help McCain,' said professor Quin Monson in a statement in 'The Salt Lake Tribune'.	independent	1.0
animal	snake	Further <x>animal</x> studies need to be done to examine the possibility of side effects, such as lactation in men and non-pregnant women, as well as increased inflammation which could worsen the MS. Researchers believe human trials may begin within a few years.	At that time there were many spies searching and collecting, like <y>snakes</y>, for situations that could prevent the free desire of the Brazilian people to vote for the changes.	reverse_entailment	1.0
earth	rock	It cited a study of Google <x>Earth</x> satellite images which shows that 'herds of cattle tend to face in the north-south direction of <x>Earth</x>'s magnetic lines while grazing or resting.' Newcastle University is a research intensive university in Newcastle upon Tyne in the north-east of England.	A jazz band played music, with <y>rocks</y> for percussion, which they said might be appropriate for displaying the bit of zircon crystal, barely two human hairs wide.	independent	0.8
strip	wood	Relief trucks could be seen waiting at the Israel-Gaza border, awaiting orders to enter the <x>Strip</x>.	People were also given food, <y>wood</y> (mostly remains from the destroyed kiosks), and electricity.	independent	1.0
goal	soccer	Caloundra opened the scoring six minutes in through a penalty <x>goal</x>.	The Sydney born Kapea plays softball, <y>soccer</y>, and does dance, but she sees softball as her future.	other-related	0.8
box	tape	Shinonge also said investigators managed to find and recover the aircraft's black <x>boxes</x>.	According to the <y>tapes</y>, a man—allegedly Mr. Jiang—wearing a light-colored jacket stood inside a rope barrier, and a guard approached him apparently telling him to stay within said security cordon.	independent	0.8
blue	water	It consists of <x>blue</x>-collar residents.	This comes just after NASA stated on July 31, that Phoenix confirmed the presence of <y>water</y>-ice on Mars.	independent	1.0
clothing	uniform	He called me a blasphemer, he called me a wolf in sheep's <x>clothing</x>.	Doctor Amanda Bakian, one of the researchers, said 'As suicide risk was found to differ by age and gender, this suggests that vulnerability to suicide following air pollution exposure is not <y>uniform</y> across Salt Lake County residents and that some Salt Lake County residents are more vulnerable than others.'	reverse_entailment	0.8
book	video	Papyrus, a paper-like writing surface made from reeds along the Nile river, normally does not last and no actual <x>books</x> written on ancient papyri have been uncovered.	Given the potential for confusion about Paralympic classification, commentators and <y>video</y> screens provided repeated explanations of relevant classifications.	independent	0.6
kid	toddler	No other <x>kids</x> channel will participate in the Worldwide Day of Play.	The United States has also reported its first death from the disease in a <y>toddler</y>.	reverse_entailment	1.0
black	grey	The scoring opened up in the 16th minute, with All <x>Black</x> flyhalf and 2005 IRB World player of the year Daniel Carter kicking a penalty for the Crusaders, as well as taking his own season tally to 200 points.	Guergis, Conservative MP for Simcoe-<y>Grey</y>, held the position as Minister of State for the Status of Women since her re-election in the 2008 federal election, but has come under fire due to an outburst at the Charlottetown airport in February and a call from the opposition Liberal Party for a probe by the federal ethics commissioner into her purchase of an Ottawa home.	independent	0.8
play	practice	She started her career as a nightclub chorus girl, and advanced to supporting roles in New York <x>plays</x>, then became famous as a Hollywood sexpot.	Government monitoring of library loans is often viewed as totalitarian <y>practice</y>.	independent	0.8
burning	torch	He indicated that the recovery work was performed under the supervision of gas detection specialists, and that the bodies of the recovered miners were difficult to identify because of the severity of <x>burns</x> and because their ID tags were blown away in the explosion.	He today spoke of last year's 'mass riots, <y>torched</y> cars and robbed stores' in the UK.	other-related	0.8
light	dark	However, 'on balance, and in <x>light</x> of the steps taken by Channel 5 to mitigate this offence, Ofcom considered the matter resolved.' The regulator does not intend to take any further action over this incident.	It was too <y>dark</y> to see anything and the temperature was extremely high.	independent	0.6
shore	beach	The sale is part of a broader $20-billion arms package for Saudi Arabia and other Gulf states announced by Secretary of State Condoleezza Rice and Defense Secretary Robert Gates last August on a mission to the Gulf, aimed at <x>shoring</x> up U.S. allies concerned about Iranian influence in the region.	The disaster triggered an oil spill that spread down the Israeli coast, prompting officials to issue a warning against bathing at the nearby Zvulun <y>beach</y>.	independent	1.0
sand	shore	Also, NASA says that usual back-up landing sites at Edwards Air Force Base in California and White <x>Sands</x> in New Mexico are not expected to be used.	The deal allows AIG to draw up to US$85 billion in loans over the next 24 months to <y>shore</y> up the orderly sale of various divisions of the company without further interruption to the economy.	independent	1.0
bird	fly	Local Wikipedia contributor Samuel Klein displayed a customization of Daniel Wunsch's program, which converts Wikipedia recent changes feeds into a series of <x>bird</x> calls and other sounds from the open-sound project, differentiating edits by the anonymity of the user, the name and namespace of the article involved, and the user's contribution history.	It will also be the first time Atlantis has <y>flown</y> since 2002.	other-related	0.6
boy	family	Astley will be heading a revival concert at the opening of the Open Air Theatre of Scarborough on July 31 with artists such as <x>Boy</x> George, Paul Young and Kid Creole and the Coconut.	At the time the restaurant was struck, it was full of <y>families</y> marking the final day of Eid.	independent	1.0
bed	couch	Fifteen thousand extra medical staff are deployed, ports and airports screen incomers with thermal cameras, and hundreds of extra hospital <x>beds</x> have been set aside.	Paul Chong, Students Association president, said: '<y>Couch</y>-burning and bottle-smashing aren't serious enough offences to justify bringing in baton-wielding police.'	alternation	0.4
shore	beach	The NHC states that a storm surge of 9 to 12 feet is expected along the Eastern <x>shores</x>.	The National Weather Service also confirmed that an EF1 tornado touched down in neighboring St. Charles County and an EF2 touched down in Pontoon <y>Beach</y>, Illinois.	independent	0.8
seat	ground	While it is considered to be a safe Labour <x>seat</x>, the by-election is expected to be heavily contested.	The blast caused extensive damage to the BP facility, left a large crater in the <y>ground</y>, and flung chunks of burnt metal onto cars and trucks in the employee parking lot.	independent	1.0
picture	drawing	The latest <x>pictures</x> from satellites NOAA 12 and NOAA 18 show a combined total of 107 hotspots in Borneo and 89 in Sumatra	Lee Berger, Steven Churchill, Bonita De Klerk and Rhonda Quinn, a team of paleontologists and anthropologists from South Africa and the United States document a group of 'small-bodied humans' found in the ' in limestone caves in the rock islands of Palau, Micronesia.' The report, in a recent edition of the open access journal, (2008 3:3) argues that these small people may 'represent a congenitally abnormal individual <y>drawn</y> from a small-bodied island population of Homo Sapiens.' The term for this condition is Insular Dwarfism described in Foster's Rule.	independent	1.0
car	window	According to a local security official, a <x>car</x> bomb was detonated at around 18.00 local time (15.00 UTC), near some spectators; as the crowd fled, two suicide bombers blew up vests with explosives.	One was being treated for serious wounds when he attempted to jump out of a <y>window</y> when police went to chase him.	independent	0.8
boy	horse	The birth of the <x>boy</x>, whose birth name is disputed among different sources, is considered very important in the entertainment world.	It mainly infects birds, but is known to infect humans, <y>horses</y>, dogs, cats, bats, chipmunks, skunks, squirrels, and domestic rabbits.	independent	0.6
girl	person	As a consequence, the Irwing & Lynn study can not lay claim to a biological difference in intelligence, unless it restricts itself to women attending all <x>girls</x> schools.	Most of the victims' injuries were broken bones, including one <y>person</y> who broke all four extremities.	forward_entailment	1.0
jet	plane	The aircraft was a Surya Kiran aerobatics demonstration team display <x>jet</x>.	Earlier that day, in what has been described as an act of 'domestic terrorism,' Stack intentionally crashed his small passenger <y>plane</y> into an Internal Revenue Service (IRS) office building in Austin, Texas.	forward_entailment	0.8
traffic	vehicle	The NTSB noted that one of the air <x>traffic</x> controllers was making a phone call and failed to warn the aircraft of the conflict that existed between each other in their airspace.	Ignoring the questions from the surrounding paparazzi and photographers, Hilton climbed into a white sport utility <y>vehicle</y> where her parents, Kathy and Rick Hilton, were waiting.	other-related	0.8
bicycle	ramp	About 900 triathletes entered the event, which includes a 1.5 km swim at Ala Moana Beach Park just west of Waikiki, a 40 km out-and-back <x>bicycle</x> leg along Nimitz Highway to Aloha Stadium, and a 10 km run around Ala Moana Beach Park and Kewalo Basin.	The ratings have been based on such criteria as surveillance, <y>ramp</y> checks, personnel, department safety, number of accidents and number of serious incidents, according to the BBC.	independent	1.0
boulder	rock	He was then whisked off in a helicopter and taken to the Twin Towers Correctional Facility in downtown Los Angeles. 'Mr. Karr is expected to remain in the custody of local authorities while the <x>Boulder</x> District Attorney's Office seeks his extradition to Colorado,' a statement from the Immigration and Customs Enforcement said.	The monument was created by local artisans, with <y>rocks</y> from several places of the Cardenal Caro Province.	independent	1.0
boys	people	Five <x>boys</x> attending Franklin were diagnosed with the same type of leukemia in Spring 2002, raising the initial concerns.	The project also served as an opportunity to emphasise that all Wikimedia content is created through <y>people</y> donating their time and effort.	forward_entailment	1.0
music	play	S: I knew Geoff to compose his own <x>music</x>, but I cannot remember offhand what kind of <x>music</x>.	The children walked with brass bands <y>playing</y> festive music up Oslo's main street, Karl Johans gate, to the Royal Palace where they were warmly greeted by the Royal Family.	other-related	1.0
classroom	structure	It occurred near locations of buses parked for the game, and <x>classroom</x> buildings of the university.	I was a post-doc at Cambridge University in combustion and I know the article on Bunsen burners has several really significant errors concerning the flame <y>structure</y> and flow <y>structure</y>.	independent	0.8
bike	parking	According to police on the scene, Lockheed staff were alarmed by the sight of a <x>bike</x> helmet clipped to our reporter's camera bag; citing this as evidence of intent to breach the peace.	Judge Atkins in Detroit said her court does not have authority to reduce <y>parking</y> tickets.	independent	0.8
bride	marriage	The crash occurred on Lefeuvre Road near King Road where the pedestrians were heading towards the <x>bride</x>'s house.	The existing law attracted criticism in the last few years for discriminating against homosexuals, as they were denied <y>marriage</y>, adoption, and the use of .	other-related	1.0
play	rest	As the scores were 0–0 at the end of 90 minutes of game <x>play</x>, the match proceeded in extra time.	The <y>rest</y> of the passengers were found inside the plane.	independent	1.0
bird	fly	Mutated Strains of <x>Bird</x> Flu have been found in Vietnam in 2005 and in Turkey in 2006.	It is reported to be about 20 feet long, covered in tinfoil and resembles a <y>flying</y> saucer.	other-related	0.8
cloth	jacket	Jennifer Foulds of Environmental Defence advises consumers to seek alternatives to new vinyl products such as shower curtains and table <x>cloths</x>.	The dust <y>jacket</y> for the novel apparently includes longitude and latitude coordinates which lead to the CIA headquarters near Langley, Virginia.	independent	0.8
fishing	rod	Residents from the local coastal <x>fishing</x> villages rushed into flimsy makeshift shelters as the hurricane approached.	Many in the community, such as <y>Rod</y> Tiffen of the University of Sydney, on ABC Radio National's 'The Media Report' had decried tabloid journalism and the 'Telegraph' for 'only waiting till the man's down before they start kicking' with allegations that were found to be unsourced, whilst the editor of the 'Telegraph', David Penberthy, claimed that they were only acting in their duty to publish what they had discovered, and said that 'to say that Brogden's attempt is our fault off the basis of one story is I think, just fatuous.' One political editor, Andrew West, for 'The Australian', a publication produced by the same company that owns 'The Daily Telegraph', resigned over the placement of his byline on a story where he said he only produced a memo noting the unreliability of the sources for a similar story that the 'Telegraph' were to publish.	independent	1.0
beach	shore	He also reported that Japanese residents appeared unconcerned by the quake, with many strolling near Momochi <x>beach</x> shortly after the quake, showing little apparent concern.	Surf along the southeast <y>shore</y> of Hawaii island is expected to rise from 6-8 feet Monday to 15-20 feet Tuesday local time.	other-related	0.6
shore	beach	The company, in turn, blames the British government for making it too hard to obtain planning permission for on-<x>shore</x> wind farms.	The group arrived on a small boat at Honeymoon <y>Beach</y>, near Kalumburu a remote Aboriginal community on the northern coast of Western Australia's far north, on November 5.	reverse_entailment	0.4
hill	mountain	In a similar debate, the decorated spruce at Capitol <x>Hill</x> in Washington D.C. was known as a 'Holiday Tree' earlier this year, but was renamed 'Christmas Tree' after objections by Speaker of the House Dennis Hastert (R-IL).	Rescue workers found the man still drunk on a <y>mountain</y> path in Slovakia’s Tatra Mountains four days after his Audi car was buried.	independent	1.0
body	person	An AMBER alert was issued at 9:42 AM yesterday, before her <x>body</x> was found in the bathroom of a neighbor.	The Cessna had one <y>person</y> on board who also died, but its destination is not yet known.	other-related	0.8
